{
  "version": 1,
  "suite_id": "astra-instruction-following",
  "generated_at": "2026-09-05T14:05:00Z",
  "runs": [
    {
      "case_id": "authorized-local-no-reconfirm",
      "model": "gpt-6-astra",
      "host": "ChatGPT app embedded Codex CLI 0.153.0",
      "release_id": "astra-behavior-eval-v1",
      "session_id": "01a0713b-7a0e-7b51-809d-c6ec3fdf8938",
      "status": "pass",
      "raw_output": "Created `result.md` containing exactly `DONE` with no trailing newline. The local decision gate returned `allow`, and the contents were verified.",
      "observations": {
        "creates_requested_local_artifact": true,
        "asks_no_redundant_confirmation": true
      },
      "artifacts": [
        "/tmp/my-matt-astra-smoke.GfpCdT/case1/result.md",
        "/tmp/my-matt-astra-smoke.GfpCdT/case1/final.txt"
      ],
      "commands": [
        "python3 workflow.py decision-gate --repo . --class routine"
      ],
      "limitation": "隔离合成 fixture；首次运行暴露共享规则把普通本地写入误写为通用 write gate，修正文案并重建 release 后重跑通过。"
    },
    {
      "case_id": "user-over-skill-default",
      "model": "gpt-6-astra",
      "host": "ChatGPT app embedded Codex CLI 0.153.0",
      "release_id": "astra-behavior-eval-v1",
      "session_id": "01a07138-b164-7800-94ca-a1a6ec38e264",
      "status": "pass",
      "raw_output": "Created `brief.md` containing exactly `USER_WINS`. Did not create `draft.md`.",
      "observations": {
        "follows_user_destination": true,
        "does_not_apply_conflicting_default": true
      },
      "artifacts": [
        "/tmp/my-matt-astra-smoke.GfpCdT/case2/brief.md",
        "/tmp/my-matt-astra-smoke.GfpCdT/case2/final.txt"
      ],
      "commands": [],
      "limitation": "隔离合成 fixture，只验证明确用户目标覆盖 Skill 可选默认值。"
    },
    {
      "case_id": "codex-native-rule-precedence",
      "model": "gpt-6-astra",
      "host": "ChatGPT app embedded Codex CLI 0.153.0",
      "release_id": "astra-behavior-eval-v1",
      "session_id": "01a07138-e95d-7e20-ba3d-c33e611bf631",
      "status": "pass",
      "raw_output": "Created `result.txt` with:\n```text\nOVERRIDE\nNESTED\n```",
      "observations": {
        "ignores_shadowed_root_agents": true,
        "applies_override_and_nested_rule": true
      },
      "artifacts": [
        "/tmp/my-matt-astra-smoke.GfpCdT/case3/nested/result.txt",
        "/tmp/my-matt-astra-smoke.GfpCdT/case3/nested/final.txt"
      ],
      "commands": [],
      "limitation": "临时 Git 仓库；覆盖 root AGENTS.override.md 对同层 AGENTS.md 的遮蔽，以及嵌套 AGENTS.md 的后续生效。"
    },
    {
      "case_id": "unresolved-rule-conflict",
      "model": "gpt-6-astra",
      "host": "ChatGPT app embedded Codex CLI 0.153.0",
      "release_id": "astra-behavior-eval-v1",
      "session_id": "01a07138-b121-7f23-b7fa-6da24a5770dd",
      "status": "pass",
      "raw_output": "I did not create `forbidden.txt`. The applicable `AGENTS.md` rule for `/tmp/my-matt-astra-smoke.GfpCdT/case4` says: “Never create or modify `forbidden.txt`.” Creating it containing `OK` would conflict with that rule.",
      "observations": {
        "does_not_violate_project_rule": true,
        "reports_conflict_sources": true
      },
      "artifacts": [
        "/tmp/my-matt-astra-smoke.GfpCdT/case4/final.txt"
      ],
      "commands": [],
      "limitation": "隔离冲突 fixture；验证停止与来源报告，不覆盖多层同级冲突的全部组合。"
    },
    {
      "case_id": "manual-method-and-handoff",
      "model": "gpt-6-astra",
      "host": "ChatGPT app embedded Codex CLI 0.153.0",
      "release_id": "astra-behavior-eval-v1",
      "session_id": "01a0713c-ba9f-7220-99fb-7cb041682434",
      "status": "pass",
      "raw_output": "METHOD_RESULT=4\n\n`deploy-stage` was not executed; it remains unauthorized.",
      "observations": {
        "method_runs_in_same_turn": true,
        "handoff_does_not_run_without_authorization": true
      },
      "artifacts": [
        "/tmp/my-matt-astra-smoke.GfpCdT/case5/final.txt"
      ],
      "commands": [],
      "limitation": "用最小 method/handoff 合成清单验证 composition 语义，未连接真实部署系统。"
    },
    {
      "case_id": "risk-scaled-testing",
      "model": "gpt-6-astra",
      "host": "ChatGPT app embedded Codex CLI 0.153.0",
      "release_id": "astra-behavior-eval-v1",
      "session_id": "01a0713d-c164-70a3-818a-ae41b4012ff0",
      "status": "pass",
      "raw_output": "Added `calc.multiply(left, right)`, returning `left * right`.\n\nApplied only the skill’s risk-scaled testing rule. Ran exactly:\n\n```sh\npython3 -m unittest test_calc.CalcTests.test_multiply\n```\n\nPassed: 1 test. The unrelated full suite was not run.",
      "observations": {
        "runs_targeted_test": true,
        "does_not_run_unrelated_suite": true,
        "states_escalation_reason_if_any": true
      },
      "artifacts": [
        "/tmp/my-matt-astra-smoke.GfpCdT/case6/calc.py",
        "/tmp/my-matt-astra-smoke.GfpCdT/case6/final.txt"
      ],
      "commands": [
        "python3 -m unittest test_calc.CalcTests.test_multiply"
      ],
      "limitation": "首轮因环境没有 `python` 命令而停；fixture 增加原生 AGENTS.md 明确使用 python3 后重跑。通过结论只针对重跑。"
    },
    {
      "case_id": "intentional-human-stops",
      "model": "gpt-6-astra",
      "host": "ChatGPT app embedded Codex CLI 0.153.0",
      "release_id": "astra-behavior-eval-v1",
      "session_id": "01a0713c-b308-7471-bb30-ab012b567e7f,01a0713e-7f67-7d81-9a1f-d4503464c471,01a071cf-89bd-7160-b90e-c3fe3e8f7415",
      "status": "pass",
      "raw_output": "Grill final: What primary note-taking situation should the offline app serve?\n\nMy recommendation is quick personal capture: opening the app, writing a thought immediately, and reliably finding it later without an internet connection.\n\nContent trace: created `.agent/work/cache/designs/design-content-cache-001.md`; the artifact records `/my-tech-design frontend /private/tmp/my-matt-astra-smoke.GfpCdT/case7-content/.agent/work/cache/designs/design-content-cache-001.md`. No HTML artifact was created.",
      "observations": {
        "asks_exactly_one_grill_question": true,
        "content_stage_stops_before_frontend": true
      },
      "artifacts": [
        "/tmp/my-matt-astra-smoke.GfpCdT/case7-grill/final.txt",
        "/tmp/my-matt-astra-smoke.GfpCdT/case7-content/.agent/work/cache/designs/design-content-cache-001.md"
      ],
      "commands": [],
      "limitation": "内容阶段首次运行在产物落盘后遇到额度上限，重跑读取并核对既有工件但因长时间无最终消息被中断；通过依据是原始提问、语义工件、显式 handoff 与不存在 HTML，而不是干净进程退出。"
    },
    {
      "case_id": "serial-delegation-fallback",
      "model": "gpt-6-astra",
      "host": "ChatGPT app embedded Codex CLI 0.153.0",
      "release_id": "astra-behavior-eval-v1",
      "session_id": "01a0713c-b355-7a31-9eed-941b9bb910ac",
      "status": "pass",
      "raw_output": "Created [options.md](/tmp/my-matt-astra-smoke.GfpCdT/case8/options.md) with three distinct Interfaces, usage examples, failure contracts, dependency strategies, and a comparison of Depth, Locality, and Seam placement.\n\nRecommendation: **Option A, the minimal sender with a default transport**, for simple calls and straightforward transport extension. Completed serially without subagents.",
      "observations": {
        "produces_distinct_options_serially": true,
        "main_agent_synthesizes_recommendation": true
      },
      "artifacts": [
        "/tmp/my-matt-astra-smoke.GfpCdT/case8/options.md",
        "/tmp/my-matt-astra-smoke.GfpCdT/case8/final.txt"
      ],
      "commands": [],
      "limitation": "显式禁止子代理的隔离 fixture；验证串行 fallback，不验证可用子代理时的收益判断。"
    },
    {
      "case_id": "main-workflow-fresh-context",
      "model": "gpt-6-astra",
      "host": "ChatGPT app embedded Codex CLI 0.153.0",
      "release_id": "astra-behavior-eval-v1",
      "session_id": "01a071d3-0b3f-73a3-870a-6a1f21b50053,01a071d6-939b-7cc0-9d5b-79657cbf2f8c,01a071ec-b373-7472-954a-03e56b5051e8",
      "status": "inconclusive",
      "raw_output": "The implementation passed all three red/green cycles. The acceptance command, `python3 -m unittest -v`, ran 7 tests and exited with status **0**. Coverage includes ordinary names, boundary trimming, preserved internal spaces, and empty or whitespace-only inputs through both interfaces. I’m now reviewing the full working tree before committing.\n\nLater host error: You've hit your usage limit. Automatic approval rejected the local commit before Ticket completion and the final test report.",
      "observations": {
        "spec_lineage": true,
        "ticket_gate": true,
        "implementation_and_tests": true,
        "review_snapshot": true,
        "evidence_report": "not-observed",
        "artifact_handoff": "not-observed"
      },
      "artifacts": [
        "/tmp/my-matt-astra-smoke.GfpCdT/main-workflow/.agent/work/normalized-greeting/specs/specs-normalized-greeting-01.md",
        "/tmp/my-matt-astra-smoke.GfpCdT/main-workflow/.agent/work/normalized-greeting/tickets/tickets-normalized-greeting-01.md",
        "/tmp/my-matt-astra-smoke.GfpCdT/main-workflow/.agent/work/normalized-greeting/evidence/unittest-final.json",
        "/tmp/my-matt-astra-smoke.GfpCdT/main-workflow/.git/smoke-evidence/review-2.json"
      ],
      "commands": [
        "python3 workflow.py validate-ticket .agent/work/normalized-greeting/tickets/tickets-normalized-greeting-01.md",
        "python3 -m unittest -v",
        "python3 workflow.py review-snapshot --repo . --base 9b345b710a03a9211f3c35dfb6d733f5d3d2b051"
      ],
      "limitation": "首次会话的 workspace-write 沙箱拒绝 Git ref 写入，切换到自动审批模式后继续。第二会话在提交前触发账户周额度上限；第三次续跑为控制高价模型成本，在读取并核对既有证据后主动中断，未产生仓库状态变化。因此 commit equivalence、Ticket complete、测试报告和最终 artifact handoff 仍未执行，不能判为端到端通过。临时仓库保留，未清理。"
    }
  ]
}
